{
  "format_version": "3.0-test.1",
  "status": "design_test_only",
  "entities": [
    {
      "id": "u.call",
      "type": "Usage",
      "properties": {
        "lemma": "부르다",
        "sense": "말로 사람의 주의를 끌다",
        "pos": "동사"
      }
    },
    {
      "id": "u.full",
      "type": "Usage",
      "properties": {
        "lemma": "부르다",
        "sense": "먹은 것이 많아 속이 꽉 찬 상태",
        "pos": "형용사"
      }
    },
    {
      "id": "u.good",
      "type": "Usage",
      "properties": {
        "lemma": "좋다",
        "pos": "형용사",
        "sense": null
      }
    },
    {
      "id": "c.nikkyeo",
      "type": "Construction",
      "properties": {
        "label": "위키의 안동 중심 니껴형 서술 용법"
      }
    },
    {
      "id": "c.ge",
      "type": "Construction",
      "properties": {
        "label": "-게의 의미별 대응 구성"
      }
    },
    {
      "id": "f.니더",
      "type": "Form",
      "properties": {
        "text": "-니더"
      }
    },
    {
      "id": "f.이더",
      "type": "Form",
      "properties": {
        "text": "-이더"
      }
    },
    {
      "id": "f.니이더",
      "type": "Form",
      "properties": {
        "text": "-니이더"
      }
    },
    {
      "id": "f.구로",
      "type": "Form",
      "properties": {
        "text": "-구로"
      }
    },
    {
      "id": "f.그로",
      "type": "Form",
      "properties": {
        "text": "-그로"
      }
    },
    {
      "id": "f.고로",
      "type": "Form",
      "properties": {
        "text": "-고로"
      }
    }
  ],
  "evidence": [
    {
      "id": "e.contrast",
      "source_id": "NAMU_HONORIFICS_20260908",
      "pdf_pages": [
        14,
        33
      ],
      "locator": "14쪽 부르다 대조; 33쪽 각주 41",
      "excerpt": "동사: 친구가 부르니더 / 형용사: 배 부르니더(X) → 배 부르이더",
      "kind": "source_statement"
    },
    {
      "id": "e.exception",
      "source_id": "NAMU_HONORIFICS_20260908",
      "pdf_pages": [
        14
      ],
      "locator": "불규칙 활용 표",
      "excerpt": "좋니더/좋으이더",
      "kind": "source_statement"
    },
    {
      "id": "e.general",
      "source_id": "NAMU_HONORIFICS_20260908",
      "pdf_pages": [
        14
      ],
      "locator": "형용사 니더/이더 설명",
      "excerpt": "즉 '(자음)니더', '(모음)이더'이다.",
      "kind": "source_statement"
    },
    {
      "id": "e.meaning",
      "source_id": "NAMU_GRAMMAR_20260908",
      "pdf_pages": [
        48
      ],
      "locator": "각주 76",
      "excerpt": "'-하기 위해'의 의미와 강조의 의미에서만 가능하다. '빠르게 해라' 같은 곳에는 '구로/그로'를 못 쓴다.",
      "kind": "source_statement"
    },
    {
      "id": "e.region",
      "source_id": "NAMU_GRAMMAR_20260908",
      "pdf_pages": [
        48
      ],
      "locator": "각주 77",
      "excerpt": "구로, 그로는 경북 우세, 고로는 경남 우세",
      "kind": "source_statement"
    },
    {
      "id": "e.age",
      "source_id": "NAMU_HONORIFICS_20260908",
      "pdf_pages": [
        14
      ],
      "locator": "니이더 설명",
      "excerpt": "'니더'가 '니이더'로 길게 발음되는 것은 늙은 사람들이 사용하는 보수적인 형태이다.",
      "kind": "source_statement"
    },
    {
      "id": "e.jo",
      "source_id": "JO2018",
      "pdf_pages": [
        90
      ],
      "locator": "인쇄 78쪽 예문 40ㄱ; 7-9:1068/안동",
      "excerpt": "깨끗하게 푸만 좋으이더. 푸시더.",
      "kind": "reported_attestation"
    },
    {
      "id": "e.scope",
      "source_id": "NAMU_HONORIFICS_20260908",
      "pdf_pages": [
        13,
        14
      ],
      "locator": "니껴형 절과 안동 지역어 연구 참고 설명",
      "excerpt": "아래 내용 대부분은 안동 대학교 김정균 교수의 '안동 지역어의 종결어미 연구'를 참고했다.",
      "kind": "source_statement"
    }
  ],
  "claims": [
    {
      "id": "T01",
      "record_type": "grammatical_assertion",
      "categories": [
        "종결어미",
        "품사별 결합"
      ],
      "source_terms": [],
      "target_refs": [
        "u.call",
        "u.full",
        "c.nikkyeo"
      ],
      "assertions": [
        {
          "id": "a.call",
          "kind": "accepted_example",
          "target_refs": [
            "u.call",
            "f.니더"
          ],
          "content": {
            "text": "친구가 부르니더"
          },
          "condition": null
        },
        {
          "id": "a.full",
          "kind": "accepted_example",
          "target_refs": [
            "u.full",
            "f.이더"
          ],
          "content": {
            "text": "배 부르이더"
          },
          "condition": null
        },
        {
          "id": "a.full.no",
          "kind": "rejected_example",
          "target_refs": [
            "u.full",
            "f.니더"
          ],
          "content": {
            "text": "배 부르니더"
          },
          "condition": null
        }
      ],
      "evidence_refs": [
        "e.contrast",
        "e.scope"
      ],
      "annotations": [
        {
          "id": "T01.region",
          "dimension": "region",
          "value": {
            "observed_context": "안동 중심 니껴형 설명",
            "exclusive_to_region": null
          },
          "basis": "source_context",
          "evidence_refs": [
            "e.contrast",
            "e.scope"
          ],
          "missing_reason": null
        },
        {
          "id": "T01.period",
          "dimension": "utterance_period",
          "value": null,
          "basis": "not_established",
          "evidence_refs": [],
          "missing_reason": "개별 예·설명의 실제 조사 또는 발화 시기 미확보"
        },
        {
          "id": "T01.context",
          "dimension": "usage_context",
          "value": {
            "kind": "문법 설명",
            "speaker_listener": null
          },
          "basis": "source_context",
          "evidence_refs": [
            "e.contrast",
            "e.scope"
          ],
          "missing_reason": null
        }
      ],
      "relations": [],
      "gaps": [
        "현대 사용 선호 미확인",
        "미기재 결합은 금지가 아니라 미확보"
      ],
      "review": {
        "format": "user_accepted",
        "linguistic_truth": "not_human_verified",
        "extraction": "draft"
      }
    },
    {
      "id": "T02",
      "record_type": "grammatical_assertion",
      "categories": [
        "종결어미",
        "활용 예외"
      ],
      "source_terms": [],
      "target_refs": [
        "u.good",
        "c.nikkyeo"
      ],
      "assertions": [
        {
          "id": "a.good",
          "kind": "allowed_variants",
          "target_refs": [
            "u.good",
            "f.니더",
            "f.이더"
          ],
          "content": {
            "forms": [
              "좋니더",
              "좋으이더"
            ],
            "relative_frequency": null
          },
          "condition": null
        }
      ],
      "evidence_refs": [
        "e.exception",
        "e.scope"
      ],
      "annotations": [
        {
          "id": "T02.region",
          "dimension": "region",
          "value": {
            "observed_context": "안동 중심 니껴형 설명",
            "exclusive_to_region": null
          },
          "basis": "source_context",
          "evidence_refs": [
            "e.exception",
            "e.scope"
          ],
          "missing_reason": null
        },
        {
          "id": "T02.period",
          "dimension": "utterance_period",
          "value": null,
          "basis": "not_established",
          "evidence_refs": [],
          "missing_reason": "개별 예·설명의 실제 조사 또는 발화 시기 미확보"
        },
        {
          "id": "T02.context",
          "dimension": "usage_context",
          "value": {
            "kind": "문법 설명",
            "speaker_listener": null
          },
          "basis": "source_context",
          "evidence_refs": [
            "e.exception",
            "e.scope"
          ],
          "missing_reason": null
        }
      ],
      "relations": [
        {
          "type": "exception_to",
          "target": "T06",
          "basis": "source_statement",
          "evidence_refs": [
            "e.exception",
            "e.general"
          ]
        }
      ],
      "gaps": [
        "현대 사용 선호 미확인",
        "미기재 결합은 금지가 아니라 미확보"
      ],
      "review": {
        "format": "user_accepted",
        "linguistic_truth": "not_human_verified",
        "extraction": "draft"
      }
    },
    {
      "id": "T03",
      "record_type": "grammatical_assertion",
      "categories": [
        "연결어미",
        "의미별 결합"
      ],
      "source_terms": [],
      "target_refs": [
        "c.ge",
        "f.구로",
        "f.그로"
      ],
      "assertions": [
        {
          "id": "a.ge",
          "kind": "conditional_correspondence",
          "target_refs": [
            "c.ge",
            "f.구로",
            "f.그로"
          ],
          "content": {
            "input_form": "-게",
            "output_forms": [
              "-구로",
              "-그로"
            ],
            "condition_role": "source_stated_meaning_restriction_not_complete_generation_rule",
            "examples": [
              "낼 하구로 준비 하이소",
              "아유, 찝찝하구로..."
            ]
          },
          "condition": {
            "op": "any",
            "args": [
              {
                "op": "eq",
                "target": "c.ge",
                "feature": "meaning",
                "value": "목적"
              },
              {
                "op": "eq",
                "target": "c.ge",
                "feature": "meaning",
                "value": "강조"
              }
            ]
          }
        },
        {
          "id": "a.ge.no",
          "kind": "restricted_input_example",
          "target_refs": [
            "c.ge",
            "f.구로",
            "f.그로"
          ],
          "content": {
            "text": "빠르게 해라",
            "restriction": "이 예의 -게를 -구로/-그로로 바꾸지 못한다는 문헌 판단"
          },
          "condition": null
        }
      ],
      "evidence_refs": [
        "e.meaning"
      ],
      "annotations": [
        {
          "id": "T03.region",
          "dimension": "region",
          "value": {
            "observed_context": "경상도 문법 자료",
            "widespread_use_established": null
          },
          "basis": "source_context",
          "evidence_refs": [
            "e.meaning"